{
 "versione_schema": "1.0.0",
 "generato_il": "2026-10-24T10:42:00+02:00",
 "licenza": {
  "testi": "CC BY-SA 4.0",
  "url": "https://creativecommons.org/licenses/by-sa/4.0/deed.it",
  "attribuzione": "Bilancia Civica – https://bilanciacivica.github.io/bilancia-civica/ – CC BY-SA 4.0",
  "esclusioni": "Sono esclusi dalla licenza i testi degli atti ufficiali, non protetti dal diritto d'autore (art. 5 L. 633/1941), e le citazioni di terzi, che restano dei rispettivi autori (art. 70 L. 633/1941)."
 },
 "avvertenza": "Contenuti informativi, non consulenza legale. Le fonti ufficiali restano il riferimento; per un caso concreto è opportuno rivolgersi a un avvocato, a un sindacato, a un patronato o a un'associazione di tutela dei diritti.",
 "schema": "https://bilanciacivica.github.io/bilancia-civica/dati/schema-affermazioni.json",
 "totale": 5,
 "affermazioni": [
  {
   "id": "home-b94d95c585",
   "testo": "È il decreto-legge 22 ottobre 2026, n. 190, in vigore dal 23 ottobre 2026. Il Parlamento deve convertirlo in legge, anche con modifiche, entro il 21 dicembre 2026; altrimenti il decreto perde efficacia fin dall'inizio.",
   "etichetta": "FATTO",
   "certezza": "Alta",
   "nota_etichetta": null,
   "etichetta_ereditata": false,
   "contesto": null,
   "tema": "decreto-sicurezza",
   "pagina": {
    "url": "https://bilanciacivica.github.io/bilancia-civica/index.html#af-home-b94d95c585",
    "titolo": "Bilancia Civica · Ogni decreto, pesato sulla tua vita",
    "sezione": null
   },
   "riferimenti_normativi": [
    {
     "citazione": "decreto-legge 22 ottobre 2026, n. 190",
     "atto": "D.L. 190/2026",
     "articolo": null
    }
   ],
   "fonti": [
    {
     "titolo": "decreto-legge 22 ottobre 2026, n. 190",
     "url": "https://www.gazzettaufficiale.it/eli/id/2026/10/22/26G00214/SG",
     "ufficiale": true,
     "origine": "collegamento nel testo"
    }
   ],
   "senza_fonte_collegata": false,
   "data_aggiornamento": "2026-10-24T10:42:00+02:00"
  },
  {
   "id": "diritti-bed242ab67",
   "testo": "Riunirsi pacificamente e senz'armi è un diritto (art. 17 Cost.). In piazza o in strada serve un preavviso al questore, che è una comunicazione e non una richiesta di autorizzazione.",
   "etichetta": "FATTO",
   "certezza": "Alta",
   "nota_etichetta": null,
   "etichetta_ereditata": false,
   "contesto": null,
   "tema": "presidi",
   "pagina": {
    "url": "https://bilanciacivica.github.io/bilancia-civica/diritti.html#af-diritti-bed242ab67",
    "titolo": "Bussola Diritti",
    "sezione": null
   },
   "riferimenti_normativi": [
    {
     "citazione": "art. 17 Cost.",
     "atto": "Costituzione",
     "articolo": "17"
    }
   ],
   "fonti": [
    {
     "titolo": "Costituzione della Repubblica italiana",
     "url": "https://www.normattiva.it/uri-res/N2Ls?urn:nir:stato:costituzione:1947-12-27",
     "ufficiale": true,
     "origine": "riferimento normativo citato"
    }
   ],
   "senza_fonte_collegata": false,
   "data_aggiornamento": "2026-10-24T10:42:00+02:00"
  },
  {
   "id": "diritti-bdc5ec4599",
   "testo": "Il questore può vietare la riunione o prescriverne tempi, luoghi e percorsi. L'art. 18 TULPS cita l'omesso preavviso e ragioni di ordine pubblico, moralità o sanità pubblica; l'art. 17 Cost. ammette il divieto solo «per comprovati motivi di sicurezza o di incolumità pubblica»",
   "etichetta": "INTERPRETAZIONE",
   "certezza": null,
   "nota_etichetta": "redazionale: prevale la Costituzione",
   "etichetta_ereditata": false,
   "contesto": "Art. 18 TULPS [FATTO · Alta] Testo seguente, senza etichetta propria: Contro divieto o prescrizioni si può ricorrere al TAR, secondo le regole generali della giustizia amministrativa.",
   "tema": "presidi",
   "pagina": {
    "url": "https://bilanciacivica.github.io/bilancia-civica/diritti.html#af-diritti-bdc5ec4599",
    "titolo": "Bussola Diritti",
    "sezione": "Riunione e manifestazione"
   },
   "riferimenti_normativi": [
    {
     "citazione": "art. 17 Cost.",
     "atto": "Costituzione",
     "articolo": "17"
    },
    {
     "citazione": "art. 18 TULPS",
     "atto": "TULPS",
     "articolo": "18"
    }
   ],
   "fonti": [
    {
     "titolo": "Costituzione della Repubblica italiana",
     "url": "https://www.normattiva.it/uri-res/N2Ls?urn:nir:stato:costituzione:1947-12-27",
     "ufficiale": true,
     "origine": "riferimento normativo citato"
    },
    {
     "titolo": "Testo unico delle leggi di pubblica sicurezza (R.D. 773/1931)",
     "url": "https://www.normattiva.it/uri-res/N2Ls?urn:nir:stato:regio.decreto:1931-06-18;773",
     "ufficiale": true,
     "origine": "riferimento normativo citato"
    }
   ],
   "senza_fonte_collegata": false,
   "data_aggiornamento": "2026-10-24T10:42:00+02:00"
  },
  {
   "id": "presidio-abc0d7d83d",
   "testo": "In piazza o in strada i promotori devono avvisare il questore almeno 3 giorni prima: è una comunicazione, non una richiesta di permesso.",
   "etichetta": "FATTO",
   "certezza": "Alta",
   "nota_etichetta": null,
   "etichetta_ereditata": false,
   "contesto": null,
   "tema": "presidi",
   "pagina": {
    "url": "https://bilanciacivica.github.io/bilancia-civica/presidio.html#af-presidio-abc0d7d83d",
    "titolo": "Presidi: cosa dice la legge",
    "sezione": null
   },
   "riferimenti_normativi": [],
   "fonti": [
    {
     "titolo": "avvisare il questore almeno 3 giorni prima",
     "url": "https://www.normattiva.it/uri-res/N2Ls?urn:nir:stato:regio.decreto:1931-06-18;773~art18",
     "ufficiale": true,
     "origine": "collegamento nel testo"
    }
   ],
   "senza_fonte_collegata": false,
   "data_aggiornamento": "2026-10-24T10:42:00+02:00"
  },
  {
   "id": "presidio-cf60ee74d2",
   "testo": "Moduli e indirizzi PEC variano da Questura a Questura: manca un elenco ufficiale unico; il riferimento è il sito della Questura competente.",
   "etichetta": "DA VERIFICARE",
   "certezza": null,
   "nota_etichetta": null,
   "etichetta_ereditata": false,
   "contesto": "Preavviso scritto alla Questura competente: promotori e recapiti, luogo, data, orari, finalità, partecipanti stimati, impianti audio, mezzi o gazebo, referente sul posto.",
   "tema": "presidi",
   "pagina": {
    "url": "https://bilanciacivica.github.io/bilancia-civica/presidio.html#af-presidio-cf60ee74d2",
    "titolo": "Presidi: cosa dice la legge",
    "sezione": "Passaggi previsti"
   },
   "riferimenti_normativi": [],
   "fonti": [],
   "senza_fonte_collegata": true,
   "data_aggiornamento": "2026-10-24T10:42:00+02:00"
  }
 ]
}
